{
  "artifact": "watchy_v1_revb",
  "fork_vs_parent_codes": [],
  "gate_clean": [],
  "groups": [
    "external-interface"
  ],
  "ok": true,
  "rows": 34,
  "tamper_net_codes": [
    "CONNECTOR_LOCK_VIOLATION"
  ],
  "tamper_series_codes": [
    "CONNECTOR_SERIES_UNJUSTIFIED"
  ],
  "unlocked_rows": []
}
